{
  "protocolVersion": 1,
  "afterCursor": "1842",
  "limit": 200,
  "outgoing": [
    {
      "envelopeVersion": 1,
      "changeId": "550e8400-e29b-41d4-a716-446655440000",
      "sourceDeviceId": "11111111-2222-4333-8444-555555555555",
      "nonce": "AAAAAAAAAAAAAAAAAAAAAAAAAAAAAAAA",
      "ciphertext": "AAAAAAAAAAAAAAAAAAAAAA"
    }
  ]
}
